<?xml version='1.0' encoding='UTF-8'?>
<buildings xmlns:xsi="http://www.w3.org/2001/XMLSchema-instance" xsi:noNamespaceSchemaLocation='../../schemas/buildings.xsd'>
  <building id='ColonyHub' name='buildings.colony_hub'>
    <graphics>
      <tech id='human' width='8' height='7' image='colony/buildings/human/colony_hub'/>
      <tech id='garthog' height='6' width='3' image='colony/buildings/garthog/colony_hub'/>
      <tech id='morgath' height='5' width='6' image='colony/buildings/morgath/colony_hub'/>
      <tech id='ychom' height='3' width='3' image='colony/buildings/ychom/colony_hub'/>
      <tech id='dribs' height='4' width='4' image='colony/buildings/dribs/colony_hub'/>
      <tech id='sullep' height='3' width='4' image='colony/buildings/sullep/colony_hub'/>
      <tech id='dargslan' height='8' width='5' image='colony/buildings/dargslan/colony_hub'/>
      <tech id='ecalep' height='4' width='4' image='colony/buildings/ecalep/colony_hub'/>
    </graphics>
    <build cost='40000' kind='MainBuilding' limit='1'/>
    <operation>
      <resource type='energy'>0</resource>
      <resource type='worker'>-960</resource>
      <resource type='food'>5000</resource>
      <resource type='police'>7500</resource>
      <resource type='hospital'>10000</resource>
      <resource type='house'>5000</resource>
    </operation>
    <upgrades/>
  </building>
  <building id='PrefabHousing' name='buildings.prefab_housing'>
    <graphics>
      <tech id='human' width='4' height='3' image='colony/buildings/human/prefab_housing'/>
      <tech id='garthog' width='2' height='2' image='colony/buildings/garthog/prefab_housing' skirmish-only='true'/>
      <tech id='morgath' width='2' height='2' image='colony/buildings/morgath/prefab_housing' skirmish-only='true'/>
      <tech id='ecalep' width='2' height='2' image='colony/buildings/ecalep/prefab_housing' skirmish-only='true'/>
      <tech id='sullep' width='2' height='1' image='colony/buildings/sullep/prefab_housing' skirmish-only='true'/>
      <tech id='ychom' width='2' height='2' image='colony/buildings/ychom/prefab_housing' skirmish-only='true'/>
      <tech id='dribs' width='2' height='1' image='colony/buildings/dribs/prefab_housing' skirmish-only='true'/>
      <tech id='dargslan' width='2' height='2' image='colony/buildings/dargslan/prefab_housing' skirmish-only='true'/>
    </graphics>
    <build cost='5600' kind='House' limit='*'/>
    <operation>
      <resource type='energy'>-850</resource>
      <resource type='worker'>-60</resource>
      <resource type='house' display='true'>7000</resource>
    </operation>
    <upgrades>
      <upgrade desc='buildings.housing.upgrade_1'>
        <resource type='house'>1.25</resource>
        <resource type='energy'>1.25</resource>
        <resource type='worker'>1.25</resource>
      </upgrade>
      <upgrade desc='buildings.housing.upgrade_2'>
        <resource type='house'>1.5</resource>
        <resource type='energy'>1.5</resource>
        <resource type='worker'>1.5</resource>
      </upgrade>
      <upgrade desc='buildings.housing.upgrade_3'>
        <resource type='house'>2</resource>
        <resource type='energy'>2</resource>
        <resource type='worker'>1.75</resource>
      </upgrade>
      <upgrade desc='buildings.housing.upgrade_4'>
        <resource type='house'>2.5</resource>
        <resource type='energy'>2</resource>
        <resource type='worker'>1.75</resource>
      </upgrade>
    </upgrades>
  </building>
  <building id='ApartmentBlock' name='buildings.apartment_block'>
    <graphics>
      <tech id='human' width='4' height='3' image='colony/buildings/human/apartment_block'/>
      <tech id='garthog' width='2' height='2' image='colony/buildings/garthog/apartment_block' skirmish-only='true'/>
      <tech id='morgath' width='2' height='3' image='colony/buildings/morgath/apartment_block' skirmish-only='true'/>
      <tech id='ecalep' width='2' height='2' image='colony/buildings/ecalep/apartment_block' skirmish-only='true'/>
      <tech id='sullep' width='2' height='2' image='colony/buildings/sullep/apartment_block' skirmish-only='true'/>
      <tech id='ychom' width='3' height='2' image='colony/buildings/ychom/apartment_block' skirmish-only='true'/>
      <tech id='dribs' width='2' height='2' image='colony/buildings/dribs/apartment_block' skirmish-only='true'/>
      <tech id='dargslan' width='2' height='3' image='colony/buildings/dargslan/apartment_block' skirmish-only='true'/>
    </graphics>
    <build cost='12000' kind='House' limit='*'/>
    <operation>
      <resource type='house' display='true'>15000</resource>
      <resource type='energy'>-1200</resource>
      <resource type='worker'>-70</resource>
    </operation>
    <upgrades>
      <upgrade desc='buildings.housing.upgrade_1'>
        <resource type='house'>1.25</resource>
        <resource type='energy'>1.25</resource>
        <resource type='worker'>1.25</resource>
      </upgrade>
      <upgrade desc='buildings.housing.upgrade_2'>
        <resource type='house'>1.5</resource>
        <resource type='energy'>1.5</resource>
        <resource type='worker'>1.5</resource>
      </upgrade>
      <upgrade desc='buildings.housing.upgrade_3'>
        <resource type='house'>2</resource>
        <resource type='energy'>2</resource>
        <resource type='worker'>1.75</resource>
      </upgrade>
      <upgrade desc='buildings.housing.upgrade_4'>
        <resource type='house'>2.5</resource>
        <resource type='energy'>2</resource>
        <resource type='worker'>1.75</resource>
      </upgrade>
    </upgrades>
  </building>
  <building name='buildings.arcology' id='Arcology'>
    <graphics>
      <tech id='human' height='4' width='3' image='colony/buildings/human/arcology'/>
      <tech id='garthog' height='2' width='3' image='colony/buildings/garthog/arcology'/>
      <tech id='morgath' height='4' width='2' image='colony/buildings/morgath/arcology'/>
      <tech id='ychom' height='3' width='3' image='colony/buildings/ychom/arcology'/>
      <tech id='dribs' height='3' width='2' image='colony/buildings/dribs/arcology'/>
      <tech id='sullep' height='2' width='2' image='colony/buildings/sullep/arcology'/>
      <tech id='dargslan' height='2' width='3' image='colony/buildings/dargslan/arcology'/>
      <tech id='ecalep' height='3' width='2' image='colony/buildings/ecalep/arcology'/>
    </graphics>
    <build limit='*' kind='House' cost='16000'/>
    <operation>
      <resource type='house' display='true'>30000</resource>
      <resource type='energy'>-1500</resource>
      <resource type='worker'>-100</resource>
    </operation>
    <upgrades>
      <upgrade desc='buildings.housing.upgrade_1'>
        <resource type='house'>1.25</resource>
        <resource type='energy'>1.25</resource>
        <resource type='worker'>1.25</resource>
      </upgrade>
      <upgrade desc='buildings.housing.upgrade_2'>
        <resource type='house'>1.5</resource>
        <resource type='energy'>1.5</resource>
        <resource type='worker'>1.5</resource>
      </upgrade>
      <upgrade desc='buildings.housing.upgrade_3'>
        <resource type='house'>2</resource>
        <resource type='energy'>2</resource>
        <resource type='worker'>1.75</resource>
      </upgrade>
      <upgrade desc='buildings.housing.upgrade_4'>
        <resource type='house'>2.5</resource>
        <resource type='energy'>2</resource>
        <resource type='worker'>1.75</resource>
      </upgrade>
    </upgrades>
  </building>
  <building name='buildings.nuclear_plant' id='NuclearPlant'>
    <graphics>
      <tech height='5' width='5' id='human' image='colony/buildings/human/nuclear_plant'/>
      <tech id='garthog' height='3' width='3' image='colony/buildings/garthog/nuclear_plant'/>
      <tech id='morgath' height='3' width='3' image='colony/buildings/morgath/nuclear_plant'/>
      <tech id='ychom' height='4' width='4' image='colony/buildings/ychom/nuclear_plant'/>
      <tech id='dribs' height='5' width='4' image='colony/buildings/dribs/nuclear_plant'/>
      <tech id='sullep' height='4' width='4' image='colony/buildings/sullep/nuclear_plant'/>
      <tech id='dargslan' height='5' width='4' image='colony/buildings/dargslan/nuclear_plant'/>
      <tech id='ecalep' height='3' width='4' image='colony/buildings/ecalep/nuclear_plant'/>
    </graphics>
    <build limit='*' kind='Power' cost='8000'/>
    <operation percent='true'>
      <resource type='energy' display='true'>3500</resource>
      <resource type='worker'>-290</resource>
    </operation>
    <upgrades>
      <upgrade desc='buildings.power.upgrade_1'>
        <resource type='energy'>1.5</resource>
        <resource type='worker'>1.25</resource>
      </upgrade>
      <upgrade desc='buildings.power.upgrade_2'>
        <resource type='energy'>2</resource>
        <resource type='worker'>1.5</resource>
      </upgrade>
      <upgrade desc='buildings.power.upgrade_3'>
        <resource type='energy'>2.5</resource>
        <resource type='worker'>2</resource>
      </upgrade>
      <upgrade desc='buildings.power.upgrade_4'>
        <resource type='energy'>3</resource>
        <resource type='worker'>2</resource>
      </upgrade>
    </upgrades>
  </building>
  <building name='buildings.fusion_plant' id='FusionPlant'>
    <graphics>
      <tech height='5' width='5' id='human' image='colony/buildings/human/fusion_plant'/>
      <tech height='5' width='3' id='garthog' image='colony/buildings/garthog/fusion_plant' skirmish-only="true"/>
      <tech height='4' width='4' id='morgath' image='colony/buildings/morgath/fusion_plant' skirmish-only="true"/>
      <tech height='4' width='4' id='ecalep' image='colony/buildings/ecalep/fusion_plant' skirmish-only="true"/>